全指材料,SH000987,今天大盘早盘出现急杀，指数一度打到3388附近，昨天我说了，55或99日均线附近，会形成b浪反弹，今天看只是修复性回升，因为五天a浪调整基本结束，接下来的b浪反弹会有2-3天，所以我不建议今天杀出去，也就是出于这个原因，正常情况之下，待b浪反弹时，如果没有质的变化，届时再逢高出局，也是不错的选择！A股市场出了问题，本周不管是成长股还是业绩预增股，下杀15-20%的比比皆是，这是极其变态的情况，需要有一个管理层面的拨乱反正，否则长此下去，民怨沸腾还是其次，会严重影响实体经济，不信就一起走着瞧！双击下面视频观看：点击观看今日最新大盘及个股点评2月2日百万模拟实盘：16.93元持有002399海普瑞100000股；14.66元持有002457青龙管业58100股；11.90元持有000987越秀金控50000股，9.80元持有300369绿盟科技50000股；8.61元持有000812陕西金叶100000股；账户目前剩余资金：81321.38元。--------------------------------------------------------注：以上博文仅代表个人观点，不构成实际操作建议，据此入市，风险自担。---------------------------------------------------------特别提醒：凡是点击订阅《展锋·东方红直播圈》三个月以上的投资者，均可免费申请开通东方红·智赢版使用权！点击订阅《展锋•微财讯》特别提醒：展锋微信公众号：zftz99999、zfcj99999点击新浪微博留言互动！,"{'subscribeable': False, 'remark': None, 'status': 0, 'common_count': 0, 'domain': 'zhanfeng', 'type': '1', 'location': None, 'description': '1997年开始涉足股市，曾在多家咨询公司及投资机构任职，在15年证券从业史中，历任初级研究员、中级研究员、高级研究员、研究部总监、投资部总监、私募基金经理等职。有6年以上国内机构操盘的经验，2010年12月底通过证券从业资格考试；2013年3月16日独立开发完成极具实战价值《东方红证券金融终端》，国家版权局计算机软件著作权登记证书为2013sr059087。', 'id': 8279054471, 'url': None, 'follow_me': False, 'following': False, 'verified_description': None, 'screen_name': '展锋-天人合一', 'step': 'null', 'profile': '/zhanfeng', 'gender': 'm', 'province': '云南', 'city': '昆明', 'blog_description': None, 'verified': False, 'verified_type': 0, 'last_status_id': 101526145, 'st_color': '1', 'friends_count': 19, 'followers_count': 51, 'status_count': 34, 'donate_count': 0, 'blocking': False, 'stats': None, 'recommend': None, 'intro': None, 'stock_status_count': None, 'allow_all_stock': False, 'stocks_count': None, 'name': None, 'group_ids': None, 'name_pinyin': None, 'screenname_pinyin': None, 'block_status': 0, '_source': None, 'verified_realname': False, 'profile_image_url': 'community/20180/1516421152629-1516421194511.jpg,community/20180/1516421152629-1516421194511.jpg!180x180.png,community/20180/1516421152629-1516421194511.jpg!50x50.png,community/20180/1516421152629-1516421194511.jpg!30x30.png', 'photo_domain': '//xavatar.imedao.com/'}",展锋：触底确认，B浪反弹已展开？
全指材料,SH000987,前市大盘开盘的快速下杀，指数最低探至3388点，距离55日和99日均线不到10点，如果以去年的一个时段做比较，a浪是5天杀跌的话，今天看到这个点位附近，基本上也算是调整差不多了，接下来的b浪反弹，原则上会有两天半到三天，今天应该不算在内，但前提是市场消息面不要有重大变化，因为就现在的资金流来看，证券、银行、保险、建筑等权重蓝筹，依旧在净流出排行榜前列。创业板虽然出现一定幅度反弹，但由于15分钟天人合一指标依旧在弱势区，所以在没有下破50数值前，想要有什么样好的表现，是基本不可能的。此外，我个人依旧建议不要急于补仓，即使是手中被套的品种，如果15分钟没有下过50数值，就没有任何出手补仓的必要，现在的市场极其变态，并不是谈任何价值的时候，即使年报大幅预增的个股，出现一两个跌停也是很正常，主要是市场生态遭到了严重破坏，而某些人还在沾沾自喜而已！前市天人合一微信群给出了补仓获利高抛建议，该股作为创业板的蓝筹代表，在高抛之后还有逢低接回来的机会，然后找机会再做一个高抛，这样反复一两次的话，不再会很快解套，也会出现快速的盈利局面。此外，前市天人合一涨停系统没有预警个股，昨天的川恒股份表现相对不错，华通热力昨天涨停板，我个人仓位介入的是川恒股份，这个股前市表现的非常不错，15分钟天人合一有不错的高抛点，知道如何把握，才会获取更大的利润。另外，这两天个股补跌特别严重，002431棕榈股份也出现了这样的走势，该股年报业绩大幅预增，养老金参与定增应该在九块多，所以有该股的朋友，我觉得可以直接买进去了，然后关闭账户，和一个永远亏不起钱的基金，混上一些利润还是可以的！2月2日百万模拟实盘：16.93元持有002399海普瑞100000股；14.66元持有002457青龙管业58100股；11.90元持有000987越秀金控50000股，9.80元持有300369绿盟科技50000股；8.61元持有000812陕西金叶100000股；账户目前剩余资金：81321.38元。--------------------------------------------------------注：以上博文仅代表个人观点，不构成实际操作建议，据此入市，风险自担。---------------------------------------------------------特别提醒：凡是点击订阅《展锋·东方红直播圈》三个月以上的投资者，均可免费申请开通东方红·智赢版使用权！点击订阅《展锋•微财讯》特别提醒：展锋微信公众号：zftz99999、zfcj99999点击新浪微博留言互动！,"{'subscribeable': False, 'remark': None, 'status': 0, 'common_count': 0, 'domain': 'zhanfeng', 'type': '1', 'location': None, 'description': '1997年开始涉足股市，曾在多家咨询公司及投资机构任职，在15年证券从业史中，历任初级研究员、中级研究员、高级研究员、研究部总监、投资部总监、私募基金经理等职。有6年以上国内机构操盘的经验，2010年12月底通过证券从业资格考试；2013年3月16日独立开发完成极具实战价值《东方红证券金融终端》，国家版权局计算机软件著作权登记证书为2013sr059087。', 'id': 8279054471, 'url': None, 'follow_me': False, 'following': False, 'verified_description': None, 'screen_name': '展锋-天人合一', 'step': 'null', 'profile': '/zhanfeng', 'gender': 'm', 'province': '云南', 'city': '昆明', 'blog_description': None, 'verified': False, 'verified_type': 0, 'last_status_id': 101526145, 'st_color': '1', 'friends_count': 19, 'followers_count': 51, 'status_count': 34, 'donate_count': 0, 'blocking': False, 'stats': None, 'recommend': None, 'intro': None, 'stock_status_count': None, 'allow_all_stock': False, 'stocks_count': None, 'name': None, 'group_ids': None, 'name_pinyin': None, 'screenname_pinyin': None, 'block_status': 0, '_source': None, 'verified_realname': False, 'profile_image_url': 'community/20180/1516421152629-1516421194511.jpg,community/20180/1516421152629-1516421194511.jpg!180x180.png,community/20180/1516421152629-1516421194511.jpg!50x50.png,community/20180/1516421152629-1516421194511.jpg!30x30.png', 'photo_domain': '//xavatar.imedao.com/'}",展锋：探底回升，B浪反弹欲展开？
全指材料,SH000987,今天大盘再度下挫，银行、供气供热板块这今天唯一资金净流入板块，尾市主板有所抬头，也主要是银行股拉抬所致！就现在的技术面来看，创业板天人合一指标双双到了100，这是短线极度超跌的表现，也预示着在连续下跌后，或有一波反抽出现，个人觉得不具备操作价值，在市场上市公司连续平仓问题没有解决之前，估计a浪下跌不会就此结束，如果在此处展开b浪反弹，那个未来的c浪下跌空间或许会更大，所以个人建议，只要手中个股没有融资，就不必再看了，该回来的时候，都会一分不少的还给你！双击下面视频观看：点击观看今日最新大盘及个股点评2月1日百万模拟实盘：16.93元持有002399海普瑞100000股；14.66元持有002457青龙管业58100股；11.90元持有000987越秀金控50000股，9.80元持有300369绿盟科技50000股；8.61元持有000812陕西金叶100000股；账户目前剩余资金：81321.38元。--------------------------------------------------------注：以上博文仅代表个人观点，不构成实际操作建议，据此入市，风险自担。---------------------------------------------------------特别提醒：凡是点击订阅《展锋·东方红直播圈》三个月以上的投资者，均可免费申请开通东方红·智赢版使用权！点击订阅《展锋•微财讯》特别提醒：展锋微信公众号：zftz99999、zfcj99999点击新浪微博留言互动！,"{'subscribeable': False, 'remark': None, 'status': 0, 'common_count': 0, 'domain': 'zhanfeng', 'type': '1', 'location': None, 'description': '1997年开始涉足股市，曾在多家咨询公司及投资机构任职，在15年证券从业史中，历任初级研究员、中级研究员、高级研究员、研究部总监、投资部总监、私募基金经理等职。有6年以上国内机构操盘的经验，2010年12月底通过证券从业资格考试；2013年3月16日独立开发完成极具实战价值《东方红证券金融终端》，国家版权局计算机软件著作权登记证书为2013sr059087。', 'id': 8279054471, 'url': None, 'follow_me': False, 'following': False, 'verified_description': None, 'screen_name': '展锋-天人合一', 'step': 'null', 'profile': '/zhanfeng', 'gender': 'm', 'province': '云南', 'city': '昆明', 'blog_description': None, 'verified': False, 'verified_type': 0, 'last_status_id': 101526145, 'st_color': '1', 'friends_count': 19, 'followers_count': 51, 'status_count': 34, 'donate_count': 0, 'blocking': False, 'stats': None, 'recommend': None, 'intro': None, 'stock_status_count': None, 'allow_all_stock': False, 'stocks_count': None, 'name': None, 'group_ids': None, 'name_pinyin': None, 'screenname_pinyin': None, 'block_status': 0, '_source': None, 'verified_realname': False, 'profile_image_url': 'community/20180/1516421152629-1516421194511.jpg,community/20180/1516421152629-1516421194511.jpg!180x180.png,community/20180/1516421152629-1516421194511.jpg!50x50.png,community/20180/1516421152629-1516421194511.jpg!30x30.png', 'photo_domain': '//xavatar.imedao.com/'}",展锋：再度下挫，结构性股灾继续！
全指材料,SH000987,前市大盘开盘的上冲后，便一路下行，除了钢铁板块还有3.64亿净流入外，其余板块皆资金净流出，元器件、医药、化工、有色、房地产资金净流出居前，中小盘个股一片萧瑟，盘中未见有效抵抗力量，昨天大盘macd高位死叉，就说明技术面已经继续走坏，如果没有巨大努力的话，25日均线则抵挡不住，55日和99日均线附近，应该具有一定的支撑作用！昨天盘后，有技术评论说是b浪反弹，其实a浪下调还没走完，怎么就谈上了b浪反弹，这样的评论多多少少有些误人子弟，建议看一次就可以了，以后就不要再看了。接下来，60分钟的天人合一指标，已经在90以上高位重合，说明在连续下挫以后，指数已经有了一个反抽的要求，但千万别抱太大期望，稳健的朋友等调整结束后再参与，激进的朋友可以选择天人合一金标准个股！前市天人合一微信群没有买卖建议给出，有人问我：创业板什么时候才能够大幅上涨？我抓了一张月线图，大家可以一起验证，月线的创业板天人合一指标，后面只有跌破50数值，才有可能迎来一波强劲的行情，在此之前不过都是超跌反弹而已。此外，前市天人合一涨停系统预警的4只个股：蓝晓科技、华通热力、汇金科技、川恒股份，4只个股中，对于符合的是川恒股份，华通热力也算可以，我个人仓位介入了川恒股份，只买了1/2仓，毕竟现在市场非常弱，做短线还是要注意设置止损位和补仓点的。另外，昨天在微信订阅号：《A股赏金猎人手记》里给了1只个股，前市表现非常不错，如果坚持住的话，收益也是实实在在的！2月1日百万模拟实盘：16.93元持有002399海普瑞100000股；14.66元持有002457青龙管业58100股；11.90元持有000987越秀金控50000股，9.80元持有300369绿盟科技50000股；8.61元持有000812陕西金叶100000股；账户目前剩余资金：81321.38元。--------------------------------------------------------注：以上博文仅代表个人观点，不构成实际操作建议，据此入市，风险自担。---------------------------------------------------------特别提醒：凡是点击订阅《展锋·东方红直播圈》三个月以上的投资者，均可免费申请开通东方红·智赢版使用权！点击订阅《展锋•微财讯》特别提醒：展锋微信公众号：zftz99999、zfcj99999点击新浪微博留言互动！,"{'subscribeable': False, 'remark': None, 'status': 0, 'common_count': 0, 'domain': 'zhanfeng', 'type': '1', 'location': None, 'description': '1997年开始涉足股市，曾在多家咨询公司及投资机构任职，在15年证券从业史中，历任初级研究员、中级研究员、高级研究员、研究部总监、投资部总监、私募基金经理等职。有6年以上国内机构操盘的经验，2010年12月底通过证券从业资格考试；2013年3月16日独立开发完成极具实战价值《东方红证券金融终端》，国家版权局计算机软件著作权登记证书为2013sr059087。', 'id': 8279054471, 'url': None, 'follow_me': False, 'following': False, 'verified_description': None, 'screen_name': '展锋-天人合一', 'step': 'null', 'profile': '/zhanfeng', 'gender': 'm', 'province': '云南', 'city': '昆明', 'blog_description': None, 'verified': False, 'verified_type': 0, 'last_status_id': 101526145, 'st_color': '1', 'friends_count': 19, 'followers_count': 51, 'status_count': 34, 'donate_count': 0, 'blocking': False, 'stats': None, 'recommend': None, 'intro': None, 'stock_status_count': None, 'allow_all_stock': False, 'stocks_count': None, 'name': None, 'group_ids': None, 'name_pinyin': None, 'screenname_pinyin': None, 'block_status': 0, '_source': None, 'verified_realname': False, 'profile_image_url': 'community/20180/1516421152629-1516421194511.jpg,community/20180/1516421152629-1516421194511.jpg!180x180.png,community/20180/1516421152629-1516421194511.jpg!50x50.png,community/20180/1516421152629-1516421194511.jpg!30x30.png', 'photo_domain': '//xavatar.imedao.com/'}",展锋：低开低走，个股闪崩在继续！
全指材料,SH000987,$全指材料(SZ159944)$ $广发中证原材料 (F001459)$ $广发原材料联接C(F002975)$ 风险提示：投资有风险，选择需谨慎@老罗话指数投资 @今日话题@玩转ETF @徒步投资笔记 @Lagom投资@abcsystem   @爱吃海鲜的鲸鱼,"{'subscribeable': False, 'remark': None, 'status': 1, 'common_count': 0, 'domain': None, 'type': '1', 'location': None, 'description': '广发中证全指原材料ETF，场内基金简称：全指材料，基金代码：159944，A类份额：001459，C类份额：002975。', 'id': 3772325986, 'url': None, 'follow_me': False, 'following': False, 'verified_description': '广发基金旗下全指原材料ETF 官方账号', 'screen_name': '全指原材料ETF', 'step': 'null', 'profile': '/3772325986', 'gender': 'n', 'province': '广东', 'city': '城市/地区', 'blog_description': None, 'verified': True, 'verified_type': 2, 'last_status_id': 79527971, 'st_color': '1', 'friends_count': 28, 'followers_count': 60, 'status_count': 64, 'donate_count': 0, 'blocking': False, 'stats': None, 'recommend': None, 'intro': None, 'stock_status_count': None, 'allow_all_stock': False, 'stocks_count': None, 'name': None, 'group_ids': None, 'name_pinyin': None, 'screenname_pinyin': None, 'block_status': 0, '_source': None, 'verified_realname': False, 'profile_image_url': 'community/20168/1473387538761-1473387543388.jpg,community/20168/1473387538761-1473387543388.jpg!180x180.png,community/20168/1473387538761-1473387543388.jpg!50x50.png,community/20168/1473387538761-1473387543388.jpg!30x30.png', 'photo_domain': '//xavatar.imedao.com/'}",
全指材料,SH000987,今天大盘走势依旧不佳，接近150只个股出现跌停，这样大面积的跌停，犹如又一次股灾来临，让普通投资者怨声载道，其实以前我就说过，市场资金是有限，而股票却越来越多，还有人把这个称作港股化，其实我觉得这样并不符合我们的国情，因为就这样乱玩下去的话，大多数投资者必将失去信心。今天是月收盘，日线级别macd高位死叉，单靠银行、酿酒、保险、房地产、家电暂时可以拖住指数，但长此以往，多数个股将会进一步被边缘化，A股市场也就失去了它存在的意义！双击下面视频观看：点击观看今日最新大盘及个股点评1月31日百万模拟实盘：16.93元持有002399海普瑞100000股；14.66元持有002457青龙管业58100股；11.90元持有000987越秀金控50000股，9.80元持有300369绿盟科技50000股；8.61元持有000812陕西金叶100000股；账户目前剩余资金：81321.38元。--------------------------------------------------------注：以上博文仅代表个人观点，不构成实际操作建议，据此入市，风险自担。---------------------------------------------------------特别提醒：凡是点击订阅《展锋·东方红直播圈》三个月以上的投资者，均可免费申请开通东方红·智赢版使用权！点击订阅《展锋•微财讯》特别提醒：展锋微信公众号：zftz99999、zfcj99999点击新浪微博留言互动！,"{'subscribeable': False, 'remark': None, 'status': 0, 'common_count': 0, 'domain': 'zhanfeng', 'type': '1', 'location': None, 'description': '1997年开始涉足股市，曾在多家咨询公司及投资机构任职，在15年证券从业史中，历任初级研究员、中级研究员、高级研究员、研究部总监、投资部总监、私募基金经理等职。有6年以上国内机构操盘的经验，2010年12月底通过证券从业资格考试；2013年3月16日独立开发完成极具实战价值《东方红证券金融终端》，国家版权局计算机软件著作权登记证书为2013sr059087。', 'id': 8279054471, 'url': None, 'follow_me': False, 'following': False, 'verified_description': None, 'screen_name': '展锋-天人合一', 'step': 'null', 'profile': '/zhanfeng', 'gender': 'm', 'province': '云南', 'city': '昆明', 'blog_description': None, 'verified': False, 'verified_type': 0, 'last_status_id': 101526145, 'st_color': '1', 'friends_count': 19, 'followers_count': 51, 'status_count': 34, 'donate_count': 0, 'blocking': False, 'stats': None, 'recommend': None, 'intro': None, 'stock_status_count': None, 'allow_all_stock': False, 'stocks_count': None, 'name': None, 'group_ids': None, 'name_pinyin': None, 'screenname_pinyin': None, 'block_status': 0, '_source': None, 'verified_realname': False, 'profile_image_url': 'community/20180/1516421152629-1516421194511.jpg,community/20180/1516421152629-1516421194511.jpg!180x180.png,community/20180/1516421152629-1516421194511.jpg!50x50.png,community/20180/1516421152629-1516421194511.jpg!30x30.png', 'photo_domain': '//xavatar.imedao.com/'}",展锋：百股跌停，技术性调整未完！
全指材料,SH000987,前市大盘低开略反弹后一路下探，而后在保险、酿酒、银行、家电、钢铁、房地产板块力挺下，指数出现了探底回升的走势，但很明显资金流入幅度不如从前，中小盘个股又被拼命打压，许多业绩公布不及预期的个股，都纷纷奔向跌停板，就算业绩公布较好的，也难逃冲高回落的厄运。纯技术角度看，今天日线macd指标高位死叉，除非有巨大的力量将其掰开，否则之后的市场还将继续向下调整，毕竟顶底之王指标还在走坏，这个风险是不得不防的。具体操作上，个人建议不要轻易出手，没有绝对把握的时候，宁可先看一看再说，房地产、银行、保险、酿酒、家电短期略有回升，但风险还是有的，毕竟前面涨高了那么多，目前只有符合天人合一选股态势的个股，还可以做短线的关注，其它个股可以暂观望！前市天人合一微信群买入了600202哈空调，除了涨停预警信号之外，主要是该股天人合一指标在29附近运行，还属于一个强势状态，15分钟天人合一指标，如果午后可以下破50数值，该股还是有冲击涨停板的希望。此外，前面天人合一涨停系统预警的两只个股：盛达矿业、安车检测，今天表现的还不错，前者最高到了72元，后者也是有利润，以后就以此法来选择个股，相信会有非常不错的收益。另外，前天和昨天在微信订阅号：《A股赏金猎人手记》里给了两只个股，表现非常不错，苏博特的涨幅足以让人兴奋，洛凯股份的逢低买入，也是实实在在的收益！1月31日百万模拟实盘：16.93元持有002399海普瑞100000股；14.66元持有002457青龙管业58100股；11.90元持有000987越秀金控50000股，9.80元持有300369绿盟科技50000股；8.61元持有000812陕西金叶100000股；账户目前剩余资金：81321.38元。--------------------------------------------------------注：以上博文仅代表个人观点，不构成实际操作建议，据此入市，风险自担。---------------------------------------------------------特别提醒：凡是点击订阅《展锋·东方红直播圈》三个月以上的投资者，均可免费申请开通东方红·智赢版使用权！点击订阅《展锋•微财讯》特别提醒：展锋微信公众号：zftz99999、zfcj99999点击新浪微博留言互动！,"{'subscribeable': False, 'remark': None, 'status': 0, 'common_count': 0, 'domain': 'zhanfeng', 'type': '1', 'location': None, 'description': '1997年开始涉足股市，曾在多家咨询公司及投资机构任职，在15年证券从业史中，历任初级研究员、中级研究员、高级研究员、研究部总监、投资部总监、私募基金经理等职。有6年以上国内机构操盘的经验，2010年12月底通过证券从业资格考试；2013年3月16日独立开发完成极具实战价值《东方红证券金融终端》，国家版权局计算机软件著作权登记证书为2013sr059087。', 'id': 8279054471, 'url': None, 'follow_me': False, 'following': False, 'verified_description': None, 'screen_name': '展锋-天人合一', 'step': 'null', 'profile': '/zhanfeng', 'gender': 'm', 'province': '云南', 'city': '昆明', 'blog_description': None, 'verified': False, 'verified_type': 0, 'last_status_id': 101526145, 'st_color': '1', 'friends_count': 19, 'followers_count': 51, 'status_count': 34, 'donate_count': 0, 'blocking': False, 'stats': None, 'recommend': None, 'intro': None, 'stock_status_count': None, 'allow_all_stock': False, 'stocks_count': None, 'name': None, 'group_ids': None, 'name_pinyin': None, 'screenname_pinyin': None, 'block_status': 0, '_source': None, 'verified_realname': False, 'profile_image_url': 'community/20180/1516421152629-1516421194511.jpg,community/20180/1516421152629-1516421194511.jpg!180x180.png,community/20180/1516421152629-1516421194511.jpg!50x50.png,community/20180/1516421152629-1516421194511.jpg!30x30.png', 'photo_domain': '//xavatar.imedao.com/'}",展锋：探底回升，分化依旧在加剧！
